site_no,site_name,street_address,city_state_zip,county,media,violation_date,violation,status,resolved_date,document,full_address,latitude,longitude,id
3468,Morgan State University,"1700 E Cold Spring Ln, Spencer Hall Rm 315","Baltimore, MD, 21251",Baltimore City,SWP-Hazardous Waste,2022/10/04,No hazardous waste determination made for laboratory chemicals.,Returned to Compliance,2024/04/02,https://mdedataviewer.mde.state.md.us/OpenDataDocuments?ID=2955087,"1700 E Cold Spring Ln, Spencer Hall Rm 315, Baltimore, MD, 21251",,,369
165391,Tharos Training Center,6101 Fallard Dr,"Upper Marlboro, MD, 20772",Prince George's,SWP-Hazardous Waste,2024/10/17,"Generator did not maintain records relating to personnel engaged in hazardous waste management (job titles, job descriptions, personnel name) [COMAR 26.13.05.02G(4)(a-b)]\line\line",Returned to Compliance,2025/10/22,https://mdedataviewer.mde.state.md.us/OpenDataDocuments?ID=3347437,"6101 Fallard Dr, Upper Marlboro, MD, 20772",38.8054003,-76.8419862,370
4906,Havre De Grace Military Reservation,301 Old Bay Ln,"Havre De Grace, MD, 21078",Harford,SWP-Hazardous Waste,2025/06/10,Batteries on-site for more than 1 year,"Ongoing, Referred to Enforcement",2025/06/01,https://mdedataviewer.mde.state.md.us/OpenDataDocuments?ID=3348362,"301 Old Bay Ln, Havre De Grace, MD, 21078",39.5349206,-76.1078089,371
44,Northrop Grumman Systems Corporation - BWI,7323 Aviation Boulevard,"Linthicum, MD, 21090",Anne Arundel,SWP-Hazardous Waste,2025/07/17,The generator does not maintain an inspection log or summary as required [COMAR 26.13.03.03-6F(2)],Returned to Compliance,2025/07/17,,"7323 Aviation Boulevard, Linthicum, MD, 21090",,,372
174068,Ferguson Property,8520 Pennsylvania Ave,"Upper Marlboro, MD, 20772",Prince George's,SWP-Scrap Tire,2022/01/18,ST Open Dump,Returned to Compliance,2022/04/04,https://mdedataviewer.mde.state.md.us/OpenDataDocuments?ID=2858102,"8520 Pennsylvania Ave, Upper Marlboro, MD, 20772",38.8384367,-76.8568332,373
177931,"Ortiz New & Used Tires, LLC",311 Eastern Boulevard,"Essex, MD, 21221",Baltimore,SWP-Scrap Tire,2024/04/17,Facility does not have a ST License,Returned to Compliance,2024/03/22,https://mdedataviewer.mde.state.md.us/OpenDataDocuments?ID=3211467,"311 Eastern Boulevard, Essex, MD, 21221",39.306263,-76.4800285,374
13670,Quarantine Road Municipal Landfill,6100 Quarantine Rd,"Curtis Bay, MD, 21226",Baltimore City,SWP-Refuse Disposal,2022/03/02,Blowing litter is not controlled.,"Ongoing, Referred to Enforcement",,,"6100 Quarantine Rd, Curtis Bay, MD, 21226",,,375
151191,World Recycling Company,2740 Wilmarco Avenue,"Baltimore, MD, 21223",Baltimore City,SWP-Refuse Disposal,2022/07/24,Areas adjacent to the building are not free of litter and standing water,"Ongoing, Referred to Enforcement",,https://mdedataviewer.mde.state.md.us/OpenDataDocuments?ID=2940960,"2740 Wilmarco Avenue, Baltimore, MD, 21223",39.2732517,-76.6592961,376
66631,Grant County Mulch Laurel Facility,5402 Van Dusen Rd,"Laurel, MD, 20707",Prince George's,SWP-Natural Wood Waste,2024/03/01,Rejected wastes are not disposed of as permit requires,Returned to Compliance,2024/03/22,https://mdedataviewer.mde.state.md.us/OpenDataDocuments?ID=3117220,"5402 Van Dusen Rd, Laurel, MD, 20707",39.0819343,-76.8885367,377
177412,J & W Holding Company,3609 Fairfield Rd,"Baltimore City, MD, 21226",Baltimore City,SWP-Scrap Tire,2023/04/14,"Approximately 120 scrap tires, propane tanks, and car parts are dumped on the property.",Returned to Compliance,2024/01/23,https://mdedataviewer.mde.state.md.us/OpenDataDocuments?ID=3017318,"3609 Fairfield Rd, Baltimore City, MD, 21226",,,378
33489,"Threesome Auto Salvage, LLC",5137 Cordtown Rd,"Cambridge, MD, 21613",Dorchester,SWP-Scrap Tire,2023/08/21,Misc. significant litter and piled trash at auto salvage yard.,Returned to Compliance,2025/03/25,https://mdedataviewer.mde.state.md.us/OpenDataDocuments?ID=3065242,"5137 Cordtown Rd, Cambridge, MD, 21613",38.533059,-76.025936,379
151676,Alan Scaggs Property,5835 Scaggs Rd,"Owings, MD, 20736",Calvert,SWP-Refuse Disposal,2021/10/06,"Tires observed in several areas across the property. I observed evidence of tire burning, as seen in the attached photographs.",Returned to Compliance,2024/02/14,https://mdedataviewer.mde.state.md.us/OpenDataDocuments?ID=2835089,"5835 Scaggs Rd, Owings, MD, 20736",38.6438311,-76.6761543,380
174065,Maryland Land Holding LLC,1533 Rollins Ave,"Capitol Heights, MD, 20743",Prince George's,SWP-Scrap Tire,2022/01/17,SW Open Dump,Returned to Compliance,2024/02/05,https://mdedataviewer.mde.state.md.us/OpenDataDocuments?ID=2858073,"1533 Rollins Ave, Capitol Heights, MD, 20743",38.8697962,-76.9074938,381
165282,"Eisai, Inc",11675 Crossroads Circle,"Baltimore, MD, 21220",Baltimore,SWP-Hazardous Waste,2023/04/21,"Satellite accumulation containers are not marked ""Hazardous Waste"" or name of content [COMAR 26.13.03.05E(3)(b)]\line\line",Returned to Compliance,2023/04/20,,"11675 Crossroads Circle, Baltimore, MD, 21220",39.3537271,-76.4015121,382
31284,"P & J Contracting Company, Inc.",4300 Shannon Dr.,"Baltimore, MD, 21213",Baltimore City,SWP-Sewage Sludge,2026/01/29,No sewage sludge permit for the mixing activities,"Ongoing, Referred to Enforcement",,https://mdedataviewer.mde.state.md.us/OpenDataDocuments?ID=3391178,"4300 Shannon Dr., Baltimore, MD, 21213",39.3127955,-76.5527309,383
29763,Newland Park Municipal Landfill,6948 Brick Kiln Rd,"Salisbury, MD, 21801",Wicomico,SWP-Refuse Disposal,2023/02/02,Slopes and other areas are not stabilized adequately,"Ongoing, Referred to Enforcement",,,"6948 Brick Kiln Rd, Salisbury, MD, 21801",,,384
171464,Amrik Melhi & Ravinder Melhi et al.,10600 Marlboro Pk,"Upper Marlboro, MD, 20772",Prince George's,SWP-Refuse Disposal,2023/01/24,">80 CY of solid waste material is in an open dump. A person may not cause, suffer, allow, or permit open dumping on their property.",Returned to Compliance,2025/08/21,,"10600 Marlboro Pk, Upper Marlboro, MD, 20772",38.822706,-76.742014,385
162335,National Strategic Research Institute (NSRI),"9070 junction Drive, suite F","Annapolis Junction, MD, 20701",Howard,SWP-Hazardous Waste,2024/04/09,The generator does not maintain an inspection log or summary as required [COMAR 26.13.03.05E(1)(k)]\line\line,Returned to Compliance,2024/04/03,,"9070 junction Drive, suite F, Annapolis Junction, MD, 20701",,,386
177931,"Ortiz New & Used Tires, LLC",311 Eastern Boulevard,"Essex, MD, 21221",Baltimore,SWP-Scrap Tire,2024/04/17,Facility does not have a ST License,Returned to Compliance,2024/03/22,,"311 Eastern Boulevard, Essex, MD, 21221",39.306263,-76.4800285,387
151191,World Recycling Company,2740 Wilmarco Avenue,"Baltimore, MD, 21223",Baltimore City,SWP-Refuse Disposal,2022/07/24,Facility maintenance is not clean and sanitary,"Ongoing, Referred to Enforcement",,https://mdedataviewer.mde.state.md.us/OpenDataDocuments?ID=2940960,"2740 Wilmarco Avenue, Baltimore, MD, 21223",39.2732517,-76.6592961,388
4894,BioReliance Building 3,9900 Blackwell Rd,"Rockville, MD, 20850",Montgomery,SWP-Hazardous Waste,2025/12/29,The generator does not maintain an inspection log or summary as required [COMAR 26.13.03.03-6F(2)],Returned to Compliance,2025/11/17,https://mdedataviewer.mde.state.md.us/OpenDataDocuments?ID=3369081,"9900 Blackwell Rd, Rockville, MD, 20850",39.0999593,-77.1900841,389
8774,"Modular Components National, Inc.",2302 Industry Ct,"Forest Hill, MD, 21050",Harford,SWP-Hazardous Waste,2024/12/20,"Satellite accumulation containers are not marked ""Hazardous Waste"" or name of content [COMAR 26.13.03.05E(3)(b)]\line\line",Returned to Compliance,2024/12/12,,"2302 Industry Ct, Forest Hill, MD, 21050",39.5786112,-76.377972,390
151191,World Recycling Company,2740 Wilmarco Avenue,"Baltimore, MD, 21223",Baltimore City,SWP-Refuse Disposal,2022/02/18,"Pollution, Public health hazards, and nuisances are prevented.",Returned to Compliance,2025/06/23,https://mdedataviewer.mde.state.md.us/OpenDataDocuments?ID=2880610,"2740 Wilmarco Avenue, Baltimore, MD, 21223",39.2732517,-76.6592961,391
184263,"Jeanette Green, Coates, et al. Property",4369 Steele Neck Rd,"Vienna, MD, 21869",Dorchester,SWP-Refuse Disposal,2024/12/28,System of refuse disposal. Trash Daddyz accepts demolition debris at this address. Active Open dumping. Evidence of prior open burning. There was no active fire during the inspection. [COMAR 26.04.07.23],Returned to Compliance,2025/03/05,https://mdedataviewer.mde.state.md.us/OpenDataDocuments?ID=3257951,"4369 Steele Neck Rd, Vienna, MD, 21869",,,392
163757,Spring Garden Farm,4900 Brookeville Rd,"Brookeville, MD, 20833",Montgomery,SWP-Natural Wood Waste,2022/06/07,A log of temperature and oxygen readings is not being kept,"Ongoing, Referred to Enforcement",,https://mdedataviewer.mde.state.md.us/OpenDataDocuments?ID=2917766,"4900 Brookeville Rd, Brookeville, MD, 20833",39.1810772,-77.0620557,393
29763,Newland Park Municipal Landfill,6948 Brick Kiln Rd,"Salisbury, MD, 21801",Wicomico,SWP-Refuse Disposal,2023/07/05,leachate outbreaks are not controlled,Returned to Compliance,2023/08/31,,"6948 Brick Kiln Rd, Salisbury, MD, 21801",,,394
122,MedStar Harbor Hospital,3001 S Hanover St,"Baltimore, MD, 21225",Anne Arundel,SWP-Hazardous Waste,2025/06/20,Container used for satellite accumulation not closed [COMAR 26.13.03.05E(3)(a)]\line\line,Returned to Compliance,2025/06/09,,"3001 S Hanover St, Baltimore, MD, 21225",39.2518435,-76.6140313,395
151191,World Recycling Company,2740 Wilmarco Avenue,"Baltimore, MD, 21223",Baltimore City,SWP-Refuse Disposal,2022/07/24,All waste handling activities are not conducted in an enclosed building or other approved area,"Ongoing, Referred to Enforcement",,https://mdedataviewer.mde.state.md.us/OpenDataDocuments?ID=2940960,"2740 Wilmarco Avenue, Baltimore, MD, 21223",39.2732517,-76.6592961,396
174943,Dorchester County Property,NE/S Bobtown Rd,"Hurlock, MD, 21643",Dorchester,SWP-Refuse Disposal,2022/04/13,Unpermitted landfilling of NWW logs,Returned to Compliance,2022/06/06,https://mdedataviewer.mde.state.md.us/OpenDataDocuments?ID=2905240,"NE/S Bobtown Rd, Hurlock, MD, 21643",,,397
180425,Casey Estate Property,1612 & 1614 Dudley Corner Rd,"Millington, MD, 21651",Queen Anne's,SWP-Refuse Disposal,2024/01/16,Miscellaneous solid waste (historic household refuse and C&D waste) is present in an open dump on the property.,Returned to Compliance,2024/03/05,https://mdedataviewer.mde.state.md.us/OpenDataDocuments?ID=3093930,"1612 & 1614 Dudley Corner Rd, Millington, MD, 21651",,,398
163757,Spring Garden Farm,4900 Brookeville Rd,"Brookeville, MD, 20833",Montgomery,SWP-Natural Wood Waste,2022/06/07,Process piles are not monitored for temperature and oxygen as required by permit,"Ongoing, Referred to Enforcement",,https://mdedataviewer.mde.state.md.us/OpenDataDocuments?ID=2917766,"4900 Brookeville Rd, Brookeville, MD, 20833",39.1810772,-77.0620557,399
10777,Flavor & Fragrance Specialties,"8800 Kelso Dr, Ste P","Essex, MD, 21221",Baltimore,SWP-Hazardous Waste,2022/07/18,"Area determined to be eligible for satellite accumulation provisions is not ""at or near the point of generation"" and/or not ""under the control of the operator"" [COMAR 26.13.03.05E(3)]\line\line",Returned to Compliance,2022/07/20,https://mdedataviewer.mde.state.md.us/OpenDataDocuments?ID=2944420,"8800 Kelso Dr, Ste P, Essex, MD, 21221",,,400
9496,Home Depot HD2554,6003 Oxon Hill Rd,"Oxon Hill, MD, 20745",Prince George's,SWP-Hazardous Waste,2025/04/09,There is no adequate containment system in place [COMAR 26.13.05.09H]\line\line,"Ongoing, Referred to Enforcement",2025/03/12,https://mdedataviewer.mde.state.md.us/OpenDataDocuments?ID=3324411,"6003 Oxon Hill Rd, Oxon Hill, MD, 20745",38.8057579,-76.9786398,401
152,Suburban Hospital,8600 Old Georgetown Rd,"Bethesda, MD, 20814",Montgomery,SWP-Hazardous Waste,2024/10/15,"""Universal Waste"" sign not posted",Returned to Compliance,2024/09/10,https://mdedataviewer.mde.state.md.us/OpenDataDocuments?ID=3235946,"8600 Old Georgetown Rd, Bethesda, MD, 20814",38.998192,-77.1108161,402
178962,David J Butler at John W and Pamela E Butler Property,325 Carters Mill Rd,"Elkton, MD, 21921",Cecil,SWP-Refuse Disposal,2024/04/23,SW and ST open dumping/ open burning.,Returned to Compliance,2025/10/09,https://mdedataviewer.mde.state.md.us/OpenDataDocuments?ID=3143933,"325 Carters Mill Rd, Elkton, MD, 21921",,,403
147091,"Reeven's Auto Service, LLC",1601 N Salisbury Blvd,"Salisbury, MD, 21801",Wicomico,SWP-Scrap Tire,2025/07/17,"Facility does not have a valid license, has expired.","Ongoing, Referred to Enforcement",,https://mdedataviewer.mde.state.md.us/OpenDataDocuments?ID=3350530,"1601 N Salisbury Blvd, Salisbury, MD, 21801",38.3825716,-75.5855113,404
31830,Estes Express Lines,201 Chesapeake Blvd,"Elkton, MD, 21921",Cecil,SWP-Hazardous Waste,2023/08/02,Did not make a hazardous waste determination for a substance in a 55-gallon container,Returned to Compliance,2023/09/26,https://mdedataviewer.mde.state.md.us/OpenDataDocuments?ID=3065761,"201 Chesapeake Blvd, Elkton, MD, 21921",39.597499,-75.787753,405
165172,"Repliform, Inc","1583 Sulphur Spring Rd, Ste 104","Baltimore, MD, 21227",Baltimore,SWP-Hazardous Waste,2024/04/29,"Contingency plan has not been amended as required ( failure of plan, changes to facility, changes to personnel or equipment) [COMAR 26.13.05.04]\line\line",Returned to Compliance,2024/05/22,https://mdedataviewer.mde.state.md.us/OpenDataDocuments?ID=3143176,"1583 Sulphur Spring Rd, Ste 104, Baltimore, MD, 21227",,,406
178913,D&H Demolition LLC,7502 W B and A Rd,"Glen Burnie, MD, 21061",Anne Arundel,SWP-Refuse Disposal,2023/08/21,Solid waste open dump,Returned to Compliance,2025/12/04,https://mdedataviewer.mde.state.md.us/OpenDataDocuments?ID=3234306,"7502 W B and A Rd, Glen Burnie, MD, 21061",,,407
169192,"RAPAFUSYN Research and Development, Inc","855 N Wolfe St, Ste 102","Baltimore City, MD, 21205",Baltimore City,SWP-Hazardous Waste,2023/09/25,No hazardous waste determination,Returned to Compliance,2024/08/06,https://mdedataviewer.mde.state.md.us/OpenDataDocuments?ID=3198768,"855 N Wolfe St, Ste 102, Baltimore City, MD, 21205",,,408
151676,Alan Scaggs Property,5835 Scaggs Rd,"Owings, MD, 20736",Calvert,SWP-Refuse Disposal,2022/09/26,Open dumping.,Returned to Compliance,2024/02/14,https://mdedataviewer.mde.state.md.us/OpenDataDocuments?ID=3030478,"5835 Scaggs Rd, Owings, MD, 20736",38.6438311,-76.6761543,409
1763,"US DEPARTMENT OF AGRICULTURE, AGRICULTURAL RESEARCH SERV, BELTSVILLE RESEARCH CT","10300 Baltimore Ave, Bldg 312C","Beltsville, MD, 20705",Prince George's,SWP-Hazardous Waste,2022/09/08,Batteries not managed in a way to prevent release to the environment.,Returned to Compliance,2022/08/23,https://mdedataviewer.mde.state.md.us/OpenDataDocuments?ID=2943300,"10300 Baltimore Ave, Bldg 312C, Beltsville, MD, 20705",,,410
3034,"Galvco of Maryland, LLC, dba Baltimore Galvanizing",7110 Quad Ave,"Rosedale, MD, 21237",Baltimore,SWP-Hazardous Waste,2023/11/03,No determination made for aerosol can waste in 55 gallon drum.,Returned to Compliance,2024/01/23,https://mdedataviewer.mde.state.md.us/OpenDataDocuments?ID=3079854,"7110 Quad Ave, Rosedale, MD, 21237",39.3056686,-76.5184466,411
169713,Welch Family Limited Partnership - Station Square Apartments LLC,3699 Parkway Terrace Dr,"Suitland, MD, 20746",Prince George's,SWP-Scrap Tire,2023/11/28,"Approximately 500 scrap tires remain in an open
dump in the area described in this report.
Scrap tires may not be disposed of in an open
dump as prohibited by COMAR 26.04.08.03D(1).
A person may not cause, suffer, allow, or permit
open dumping on his property by COMAR
26.04.07.03B(4).","Ongoing, Referred to Enforcement",,https://mdedataviewer.mde.state.md.us/OpenDataDocuments?ID=3093341,"3699 Parkway Terrace Dr, Suitland, MD, 20746",38.839277,-76.926187,412
163757,Spring Garden Farm,4900 Brookeville Rd,"Brookeville, MD, 20833",Montgomery,SWP-Natural Wood Waste,2022/06/07,Pile heights do not comply with permit,"Ongoing, Referred to Enforcement",,https://mdedataviewer.mde.state.md.us/OpenDataDocuments?ID=2917766,"4900 Brookeville Rd, Brookeville, MD, 20833",39.1810772,-77.0620557,413
18757,"AA Recycle II LLC, dba Chesapeake Landscape Materials",8217 Baltimore-Annapolis Blvd.,"Pasadena, MD, 21122",Anne Arundel,SWP-Natural Wood Waste,2021/10/14,Exceeds pile dimensions,Returned to Compliance,2023/05/10,https://mdedataviewer.mde.state.md.us/OpenDataDocuments?ID=2822995,"8217 Baltimore-Annapolis Blvd., Pasadena, MD, 21122",39.1194987,-76.5660694,414
158865,Maryland Green Marble Corporation,4610 Green Marble Rd,"Whiteford, MD, 21160",Harford,SWP-Refuse Disposal,2025/05/22,SW (C&D) open dumping and grading,"Ongoing, Referred to Enforcement",,https://mdedataviewer.mde.state.md.us/OpenDataDocuments?ID=3347412,"4610 Green Marble Rd, Whiteford, MD, 21160",,,415
177606,Silver Branch LLC,899 Southern Ave,"Oxon Hill, MD, 20745",Prince George's,SWP-Refuse Disposal,2023/02/14,Solid Waste Open Dump,Returned to Compliance,2023/03/15,https://mdedataviewer.mde.state.md.us/OpenDataDocuments?ID=2982206,"899 Southern Ave, Oxon Hill, MD, 20745",38.829004,-76.991147,416
103050,Bay Town Painting Inc.,137 Stahl Point Rd,"Curtis Bay, MD, 21226",Anne Arundel,SWP-Hazardous Waste,2023/03/14,The generator does not maintain an inspection log or summary as required [COMAR 26.13.03.05E(1)(k)]\line\line,Returned to Compliance,2023/05/17,https://mdedataviewer.mde.state.md.us/OpenDataDocuments?ID=3030415,"137 Stahl Point Rd, Curtis Bay, MD, 21226",,,417
20,Eisai Inc,6611 Tributary St,"Baltimore, MD, 21224-6515",Baltimore City,SWP-Hazardous Waste,2023/09/26,Container used for satellite accumulation not closed [COMAR 26.13.03.05E(3)(a)]\line\line,Returned to Compliance,2023/09/22,,"6611 Tributary St, Baltimore, MD, 21224-6515",39.2670407,-76.5306192,418
31830,Estes Express Lines,201 Chesapeake Blvd,"Elkton, MD, 21921",Cecil,SWP-Hazardous Waste,2023/08/02,Universal waste no labeled.,Returned to Compliance,2023/09/26,https://mdedataviewer.mde.state.md.us/OpenDataDocuments?ID=3065761,"201 Chesapeake Blvd, Elkton, MD, 21921",39.597499,-75.787753,419
171461,Sylvester R & Theo Phillips Property,11730 Mill Bridge Rd,"Lusby, MD, 20657",Calvert,SWP-Refuse Disposal,2022/04/13,C&D open dump,"Ongoing, Referred to Enforcement",,,"11730 Mill Bridge Rd, Lusby, MD, 20657",38.3753211,-76.4534825,420
65313,Smith's Auto Wrecking,NW/S Bayly Rd,"Cambridge, MD, 21613",Dorchester,SWP-Scrap Tire,2024/04/14,ST (~35) and SW open dumping as observed from public road,"Ongoing, Referred to Enforcement",,https://mdedataviewer.mde.state.md.us/OpenDataDocuments?ID=3142814,"NW/S Bayly Rd, Cambridge, MD, 21613",,,421
180681,Excellent Tires Shop Auto Repair,8110 Pulaski Hwy,"Rosedale, MD, 21237",Baltimore,SWP-Scrap Tire,2024/02/01,No Scrap Tire Collection License,Returned to Compliance,2024/08/01,https://mdedataviewer.mde.state.md.us/OpenDataDocuments?ID=3105196,"8110 Pulaski Hwy, Rosedale, MD, 21237",39.3207038,-76.5086988,422
171676,ProList Inc,"4510 Buckeystown Pike, Suite M","Frederick, MD, 21704",Frederick,SWP-Hazardous Waste,2023/02/16,Generator has no contingency plan for emergencies [COMAR 26.13.05.04A]\line\line,Returned to Compliance,2023/03/10,https://mdedataviewer.mde.state.md.us/OpenDataDocuments?ID=2982467,"4510 Buckeystown Pike, Suite M, Frederick, MD, 21704",,,423
8019,"Rodgers Brothers Service, Inc.",1535 Antelope Ln,"Capitol Heights, MD, 20743",Prince George's,SWP-Refuse Disposal,2025/09/29,400 CY of site generated solid waste in 16 roll-off cans,"Ongoing, Referred to Enforcement",,https://mdedataviewer.mde.state.md.us/OpenDataDocuments?ID=3354202,"1535 Antelope Ln, Capitol Heights, MD, 20743",,,424
168071,"DAP Products, Inc",8410 Kelso Dr,"Baltimore, MD, 21221",Baltimore,SWP-Hazardous Waste,2021/12/22,A waste determination was not made.,Returned to Compliance,2021/12/01,,"8410 Kelso Dr, Baltimore, MD, 21221",39.3266965,-76.488666,425
67447,West Coast Mushrooms,342 Hopewell Rd,"Rising Sun, MD, 21911",Cecil,SWP-Scrap Tire,2023/05/19,Solid waste open dump,Returned to Compliance,2023/10/12,https://mdedataviewer.mde.state.md.us/OpenDataDocuments?ID=3028673,"342 Hopewell Rd, Rising Sun, MD, 21911",39.6872155,-76.0655525,426
4906,Havre De Grace Military Reservation,301 Old Bay Ln,"Havre De Grace, MD, 21078",Harford,SWP-Hazardous Waste,2025/06/10,The generator does not maintain an inspection log or summary as required [COMAR 26.13.03.05E(1)(k)]\line\line,"Ongoing, Referred to Enforcement",2025/06/06,https://mdedataviewer.mde.state.md.us/OpenDataDocuments?ID=3353784,"301 Old Bay Ln, Havre De Grace, MD, 21078",39.5349206,-76.1078089,427
29611,Lesher's Automotive,13714 National Pike,"Clear Spring, MD, 21722",Washington,SWP-Scrap Tire,2021/08/11,No ST License,Returned to Compliance,2025/10/16,,"13714 National Pike, Clear Spring, MD, 21722",39.659352,-77.8972069,428
19217,Worcester County Central Municipal Landfill,7091Central Site Ln,"Newark, MD, 21841",Worcester,SWP-Refuse Disposal,2024/07/01,soil cover not adequate in areas,"Ongoing, Referred to Enforcement",2024/07/15,https://mdedataviewer.mde.state.md.us/OpenDataDocuments?ID=3166959,"7091Central Site Ln, Newark, MD, 21841",,,429
64857,"MANN-PAK, Inc.","9601 Pulaski Park Dr, Ste 401","Middle River, MD, 21220",Baltimore,SWP-Hazardous Waste,2022/07/18,Container used for satellite accumulation not closed [COMAR 26.13.03.05E(3)(a)]\line\line,Returned to Compliance,2022/08/18,https://mdedataviewer.mde.state.md.us/OpenDataDocuments?ID=2955705,"9601 Pulaski Park Dr, Ste 401, Middle River, MD, 21220",,,430
11257,"Earth Movers, Inc.",7190 Brick Kiln Rd,"Salisbury, MD, 21801",Wicomico,SWP-Refuse Disposal,2024/02/13,Processing railroad ties without a refuse disposal permit,"Ongoing, Referred to Enforcement",,https://mdedataviewer.mde.state.md.us/OpenDataDocuments?ID=3106054,"7190 Brick Kiln Rd, Salisbury, MD, 21801",,,431
10777,Flavor & Fragrance Specialties,"8800 Kelso Dr, Ste P","Essex, MD, 21221",Baltimore,SWP-Hazardous Waste,2022/07/18,Generator of hazardous waste did not use required manifest [COMAR 26.13.03.04A(1)]\line\line,Returned to Compliance,2022/07/20,https://mdedataviewer.mde.state.md.us/OpenDataDocuments?ID=2943181,"8800 Kelso Dr, Ste P, Essex, MD, 21221",,,432
147840,Charlotte Hall Natural Wood Waste Recycling Facility,37308 Carpenter Ln,"Charlotte Hall, MD, 20622",St. Mary's,SWP-Natural Wood Waste,2022/10/11,Processed material pile at southwest perimeter of facility is roughly 30-40 feet from property line,Returned to Compliance,2023/12/15,https://mdedataviewer.mde.state.md.us/OpenDataDocuments?ID=2957903,"37308 Carpenter Ln, Charlotte Hall, MD, 20622",,,433
167815,SZI Real Est Enterprises,7205 Indian Head Hwy,"Bryans Road, MD, 20616",Charles,SWP-Scrap Tire,2023/10/17,ST dump,"Ongoing, Referred to Enforcement",,https://mdedataviewer.mde.state.md.us/OpenDataDocuments?ID=3132235,"7205 Indian Head Hwy, Bryans Road, MD, 20616",38.6306353,-77.0650715,434
186210,Brooklyn Tire Shop LLC,107 N Fruitland Blvd,"Fruitland, MD, 21826",Wicomico,SWP-Scrap Tire,2025/06/05,Facility is unlicensed.,Returned to Compliance,2025/09/10,https://mdedataviewer.mde.state.md.us/OpenDataDocuments?ID=3348152,"107 N Fruitland Blvd, Fruitland, MD, 21826",38.3232109,-75.6192106,435
182933,Goodwill of Monocacy Valley - Executive Court,4910 Executive Ct. South,"Frederick, MD, 21703",Frederick,SWP-Hazardous Waste,2025/08/15,The generator does not maintain an inspection log or summary as required [COMAR 26.13.03.03-6F(2)],Returned to Compliance,2025/09/04,https://mdedataviewer.mde.state.md.us/OpenDataDocuments?ID=3352043,"4910 Executive Ct. South, Frederick, MD, 21703",39.368278,-77.4211779,436
114006,"A & K Services, LLC",6707 Eads St,"Seat Pleasant, MD, 20743",Prince George's,SWP-Scrap Tire,2023/10/16,7 roll-offs stored on site with solid wastes inside and without leak-proof and rodent-proof containment.,"Ongoing, Referred to Enforcement",,https://mdedataviewer.mde.state.md.us/OpenDataDocuments?ID=3068723,"6707 Eads St, Seat Pleasant, MD, 20743",38.8926779,-76.9061468,437
67447,West Coast Mushrooms,342 Hopewell Rd,"Rising Sun, MD, 21911",Cecil,SWP-Composting,2023/05/10,Not updated.,Returned to Compliance,2023/09/28,https://mdedataviewer.mde.state.md.us/OpenDataDocuments?ID=3028674,"342 Hopewell Rd, Rising Sun, MD, 21911",39.6872155,-76.0655525,438
167276,"""Compost Crew"" formerly known as ""Key City Compost"" at Utica Bridge Farm",10661 Stull Rd,"Thurmont, MD, 21788",Frederick,SWP-Composting,2025/04/09,"Site is a commercial compost facility at the same address/parcel as the approved permit, though current composting activities are not occurring according to the CFOP/Site Plan as submitted with the Notice of Intent for General Composting Facility Permit submitted to MDE on 1/20/2021 and CFOP as revised 1/31/2024.",Returned to Compliance,2025/09/03,https://mdedataviewer.mde.state.md.us/OpenDataDocuments?ID=3324501,"10661 Stull Rd, Thurmont, MD, 21788",,,439
35186,Carl Dailey Property,10434 Bay Rd-Assateague Rd,"Berlin, MD, 21811",Worcester,SWP-Refuse Disposal,2022/04/19,SW Open Dump,Returned to Compliance,2023/04/19,https://mdedataviewer.mde.state.md.us/OpenDataDocuments?ID=2894948,"10434 Bay Rd-Assateague Rd, Berlin, MD, 21811",,,440
173506,AMGEN (AMD) - Medical Center Drive,"9605 Medical Center Drive, Suite 315","Rockville, MD, 20850",Montgomery,SWP-Hazardous Waste,2025/10/06,"Contingency plan has not been amended as required ( failure of plan, changes to facility, changes to personnel or equipment) [COMAR 26.13.05.04]\line\line",Returned to Compliance,2025/09/10,,"9605 Medical Center Drive, Suite 315, Rockville, MD, 20850",,,441
